{
  "model": "FedAvg",
  "dataset": "KU",
  "scenario": "attack_only",
  "type": "SecurityMatrixSmoke",
  "comment": "targeted_poisoning_smoke",
  "enabled_attacks": ["targeted_poisoning"],
  "enabled_defenses": [],
  "enabled_privacy_metrics": [],
  "malicious_client_config": { "enabled": true, "mode": "ratio", "ratio": 0.2, "client_ids": [] },
  "training_params": {
    "epochs": 1,
    "local_epochs": 1,
    "clients_sample_ratio": 0.05,
    "learner": "adam",
    "use_gpu": false,
    "eval_step": 1,
    "collect_round_metrics": true,
    "lr": 0.001,
    "l2_reg": 0.00001
  },
  "attack_params": {
    "targeted_poisoning": {
      "target_item_ids": [1, 2, 3],
      "targeted_poisoning_strength": 0.01,
      "preference_direction": "increase"
    }
  },
  "defense_params": {},
  "privacy_params": {},
  "extra_config": {}
}
