{
  "model": "FedAvg",
  "dataset": "KU",
  "scenario": "custom",
  "type": "SecureAggregationDemoSmoke",
  "comment": "secure_aggregation_demo_smoke",
  "enabled_attacks": [],
  "enabled_defenses": ["secure_aggregation_sim"],
  "enabled_privacy_metrics": [],
  "malicious_client_config": { "enabled": false, "mode": "none", "ratio": 0.0, "client_ids": [] },
  "training_params": {
    "epochs": 1,
    "local_epochs": 1,
    "clients_sample_ratio": 0.05,
    "learner": "adam",
    "use_gpu": false,
    "eval_step": 1,
    "collect_round_metrics": true,
    "lr": 0.001,
    "l2_reg": 0.00001
  },
  "attack_params": {},
  "defense_params": {
    "secure_aggregation_sim": {
      "secure_agg_seed": 42,
      "secure_agg_mask_std": 1.0,
      "secure_agg_max_elements": 10000
    }
  },
  "privacy_params": {
    "secure_aggregation_demo": {
      "client_count": 4,
      "dimension": 16,
      "seed": 42,
      "dropout_client_ids": [],
      "output_json": "secure_aggregation_demo_summary.json"
    }
  },
  "extra_config": {
    "smoke_only": true,
    "standalone_runner": "privacy_eval/run_secure_aggregation_demo.py",
    "demo_only": true,
    "not_production_cryptographic_protocol": true
  }
}
