{
  "model": "FedAvg",
  "dataset": "KU",
  "scenario": "privacy_observation",
  "type": "SecurityMatrixSmoke",
  "comment": "update_leakage_risk_probe_smoke",
  "enabled_attacks": [],
  "enabled_defenses": [],
  "enabled_privacy_metrics": ["update_leakage_risk_probe"],
  "malicious_client_config": { "enabled": false, "mode": "none", "ratio": 0.0, "client_ids": [] },
  "training_params": {
    "epochs": 1,
    "local_epochs": 1,
    "clients_sample_ratio": 0.05,
    "learner": "adam",
    "use_gpu": false,
    "eval_step": 1,
    "collect_round_metrics": true,
    "save_recommended_topk": true,
    "lr": 0.001,
    "l2_reg": 0.00001
  },
  "attack_params": {},
  "defense_params": {},
  "privacy_params": {
    "update_leakage_risk_probe": {
      "norm_reference": 10.0,
      "energy_reference": 100.0,
      "max_flatten_elements": 100000
    }
  },
  "extra_config": {}
}
